{
  "version": "0.1.0",
  "lastUpdate": "2026-09-01T00:00:00.000Z",
  "count": 4,
  "source": "https://observatorioia.org",
  "license": "CC BY 4.0",
  "data": {
    "capas": [
      {
        "id": "referencia-internacional",
        "orden": 1,
        "nombreCorto": {
          "es": "Principios internacionales",
          "en": "International principles"
        },
        "instrumentos": {
          "es": "OCDE, recomendaciones globales y herramientas de política pública.",
          "en": "OECD, global recommendations and public-policy tools."
        },
        "funcion": {
          "es": "Orientan la conversación país sobre IA confiable, derechos, transparencia, robustez, rendición de cuentas e innovación responsable.",
          "en": "Frame the national conversation on trustworthy AI, rights, transparency, robustness, accountability and responsible innovation."
        },
        "alcance": {
          "es": "Nivel país",
          "en": "Country level"
        },
        "fuerza": {
          "es": "Referencial",
          "en": "Referential"
        },
        "fuerzaTipo": "referencial",
        "vacio": {
          "es": "No traduce los principios en procedimientos institucionales concretos.",
          "en": "Does not translate principles into concrete institutional procedures."
        }
      },
      {
        "id": "politica-publica-nacional",
        "orden": 2,
        "nombreCorto": {
          "es": "Estrategia nacional",
          "en": "National strategy"
        },
        "instrumentos": {
          "es": "ENIA 2024-2027, Plan de Acción y diagnósticos asociados como AILA.",
          "en": "ENIA 2024-2027, Action Plan and associated diagnostics such as AILA."
        },
        "funcion": {
          "es": "Define prioridades, visión país, líneas de acción y compromisos interinstitucionales para el desarrollo y adopción de IA.",
          "en": "Defines priorities, country vision, action lines and inter-institutional commitments for AI development and adoption."
        },
        "alcance": {
          "es": "Nacional e interinstitucional",
          "en": "National and inter-institutional"
        },
        "fuerza": {
          "es": "Orientadora y coordinadora",
          "en": "Guiding and coordinating"
        },
        "fuerzaTipo": "orientadora",
        "vacio": {
          "es": "No establece por sí sola el procedimiento diario que debe seguir cada institución al adoptar, contratar, evaluar o escalar sistemas de IA.",
          "en": "Does not by itself set the daily procedure each institution must follow when adopting, procuring, evaluating or scaling AI systems."
        }
      },
      {
        "id": "lineamientos-tecnicos-obligatorios",
        "orden": 3,
        "nombreCorto": {
          "es": "CNTD, capítulo IA",
          "en": "CNTD, AI chapter"
        },
        "instrumentos": {
          "es": "Código Nacional de Tecnologías Digitales, Decreto Ejecutivo 44507-MICITT, Capítulo 7 sobre Inteligencia Artificial.",
          "en": "National Digital Technologies Code, Executive Decree 44507-MICITT, Chapter 7 on Artificial Intelligence."
        },
        "funcion": {
          "es": "Establece criterios técnicos y de gobernanza para iniciativas digitales del sector público, incluyendo gestión de riesgos, seguridad, mantenimiento, estándares técnicos, sostenibilidad, monitoreo y respuesta a incidentes.",
          "en": "Sets technical and governance criteria for public-sector digital initiatives, including risk management, security, maintenance, technical standards, sustainability, monitoring and incident response."
        },
        "alcance": {
          "es": "Sector público",
          "en": "Public sector"
        },
        "fuerza": {
          "es": "Obligatoria para iniciativas y proyectos digitales del Estado",
          "en": "Mandatory for State digital initiatives and projects"
        },
        "fuerzaTipo": "obligatoria",
        "vacio": {
          "es": "Define lineamientos y controles, pero todavía no funciona como playbook operativo único con formularios, roles, evidencias, umbrales de riesgo y flujos de aprobación estandarizados.",
          "en": "Sets guidelines and controls, but does not yet function as a single operational playbook with standardized forms, roles, evidence, risk thresholds and approval flows."
        },
        "enlaces": [
          {
            "label": {
              "es": "Ver Decreto 44507-MICITT en PGR",
              "en": "View Decree 44507-MICITT at PGR"
            },
            "url": "https://pgrweb.go.cr/scij/Busqueda/Normativa/Normas/nrm_texto_completo.aspx?nValor1=1&nValor2=102229&nValor3=141218&param1=NRTC&strTipM=TC"
          },
          {
            "label": {
              "es": "Ver CNTD vigente en MICITT",
              "en": "View current CNTD at MICITT"
            },
            "url": "https://www.micitt.go.cr/node/625"
          }
        ]
      },
      {
        "id": "legislacion-en-tramite",
        "orden": 4,
        "nombreCorto": {
          "es": "Proyectos de ley",
          "en": "Bills in process"
        },
        "instrumentos": {
          "es": "7 expedientes legislativos: 4 cuyo objeto principal es la IA y 3 directamente relacionados con propaganda digital, deepfakes, rasgos personales, creaciones digitales y manipulación coordinada.",
          "en": "7 legislative files: 4 whose primary subject is AI and 3 directly related to digital advertising, deepfakes, personal traits, digital creations and coordinated manipulation."
        },
        "funcion": {
          "es": "Busca establecer derechos, obligaciones, límites institucionales, responsabilidades y mecanismos de control.",
          "en": "Aims to establish rights, duties, institutional limits, responsibilities and control mechanisms."
        },
        "alcance": {
          "es": "Nacional",
          "en": "National"
        },
        "fuerza": {
          "es": "No vigente todavía",
          "en": "Not yet in force"
        },
        "fuerzaTipo": "no-vigente",
        "vacio": {
          "es": "Al no existir una ley aprobada, Costa Rica opera sin marco legal específico de IA. Incluso con ley, seguirá siendo necesaria una capa operativa que traduzca obligaciones legales en procedimientos institucionales.",
          "en": "With no approved law, Costa Rica operates without a specific AI legal framework. Even with a law, an operational layer translating legal duties into institutional procedures will still be necessary."
        }
      },
      {
        "id": "implementacion-institucional",
        "orden": 5,
        "nombreCorto": {
          "es": "Iniciativas institucionales",
          "en": "Institutional initiatives"
        },
        "instrumentos": {
          "es": "31 iniciativas relacionadas con IA en 11 instituciones: 7 adopciones verificadas, 8 en seguimiento y 16 registros de ecosistema y capacidades.",
          "en": "31 AI-related initiatives across 11 institutions: 7 verified adoptions, 8 under review and 16 ecosystem and capacity records."
        },
        "nota": {
          "es": "Además de proyectos en producción, existen instrumentos sectoriales de gobernanza como los Lineamientos Básicos para el uso de IA Generativa Autorizada en el Poder Judicial. Estos son relevantes pero no equivalen a un marco nacional aplicable a todo el Estado.",
          "en": "In addition to production projects, there are sectoral governance instruments such as the Basic Guidelines for the use of Authorized Generative AI in the Judiciary. These are relevant but do not amount to a national framework applicable to the entire State."
        },
        "funcion": {
          "es": "Documenta sistemas, pilotos, planes y capacidades relacionadas con IA dentro del sector público. El inventario actual reúne 31 iniciativas con distinta naturaleza y madurez; solo 7 cumplen la regla de adopción verificada.",
          "en": "Documents AI-related systems, pilots, plans and capabilities in the public sector. The current inventory includes 31 initiatives of different types and maturity; only 7 meet the verified-adoption rule."
        },
        "alcance": {
          "es": "Institucional y sectorial",
          "en": "Institutional and sectoral"
        },
        "fuerza": {
          "es": "Variable, según cada iniciativa",
          "en": "Varies by initiative"
        },
        "fuerzaTipo": "operativa",
        "vacio": {
          "es": "Las iniciativas tienen distintos niveles de evidencia, estándares y gobernanza, sin una metodología pública común para todo el Estado.",
          "en": "Initiatives have different levels of evidence, standards and governance, without a common public methodology across the State."
        }
      },
      {
        "id": "brecha-operativa",
        "orden": 6,
        "nombreCorto": {
          "es": "Procedimiento común pendiente",
          "en": "Common procedure pending"
        },
        "instrumentos": {
          "es": "Playbook nacional de IA para el sector público (pendiente).",
          "en": "National public-AI playbook (pending)."
        },
        "funcion": {
          "es": "Convertir principios, estrategia y lineamientos en procedimientos verificables para equipos institucionales.",
          "en": "Turn principles, strategy and guidelines into verifiable procedures for institutional teams."
        },
        "alcance": {
          "es": "Sector público costarricense",
          "en": "Costa Rican public sector"
        },
        "fuerza": {
          "es": "Guía operativa común, idealmente vinculada al CNTD y al modelo de gobierno digital",
          "en": "Shared operational guidance, ideally linked to the CNTD and the digital-government model"
        },
        "fuerzaTipo": "pendiente",
        "vacio": {